ffff88015f6add80 1898389779 C Ii:1:037:1 0:1 8 = 00003a00 00000000
ffff88015f6add80 1898389816 S Ii:1:037:1 -115:1 8 <
ffff88015f6add80 1898479728 C Ii:1:037:1 0:1 8 = 00000000 00000000
ffff88015f6add80 1898479756 S Ii:1:037:1 -115:1 8 <
ffff88015f6add80 1899288897 C Ii:1:037:1 0:1 8 = 00003b00 00000000
ffff88015f6add80 1899288926 S Ii:1:037:1 -115:1 8 <
ffff88015f6add80 1899398912 C Ii:1:037:1 0:1 8 = 00000000 00000000
ffff88015f6add80 1899398947 S Ii:1:037:1 -115:1 8 <
ffff88015f6add80 1900185980 C Ii:1:037:1 0:1 8 = 00003c00 00000000
ffff88015f6add80 1900186009 S Ii:1:037:1 -115:1 8 <
ffff88015f6add80 1900292983 C Ii:1:037:1 0:1 8 = 00000000 00000000
ffff88015f6add80 1900293017 S Ii:1:037:1 -115:1 8 <
ffff88015f6add80 1901093119 C Ii:1:037:1 0:1 8 = 00003d00 00000000
ffff88015f6add80 1901093144 S Ii:1:037:1 -115:1 8 <
ffff88015f6add80 1901215183 C Ii:1:037:1 0:1 8 = 00000000 00000000
ffff88015f6add80 1901215223 S Ii:1:037:1 -115:1 8 <
ffff88015f6add80 1902002263 C Ii:1:037:1 0:1 8 = 00003e00 00000000
ffff88015f6add80 1902002286 S Ii:1:037:1 -115:1 8 <
ffff88015f6add80 1902139283 C Ii:1:037:1 0:1 8 = 00000000 00000000
ffff88015f6add80 1902139305 S Ii:1:037:1 -115:1 8 <
ffff88015f6add80 1902939425 C Ii:1:037:1 0:1 8 = 00003f00 00000000
ffff88015f6add80 1902939464 S Ii:1:037:1 -115:1 8 <
ffff88015f6add80 1903090446 C Ii:1:037:1 0:1 8 = 00000000 00000000
ffff88015f6add80 1903090485 S Ii:1:037:1 -115:1 8 <
ffff88015f6add80 1903826522 C Ii:1:037:1 0:1 8 = 00004000 00000000
ffff88015f6add80 1903826545 S Ii:1:037:1 -115:1 8 <
ffff88015f6add80 1903947512 C Ii:1:037:1 0:1 8 = 00000000 00000000
ffff88015f6add80 1903947551 S Ii:1:037:1 -115:1 8 <
ffff88015f6add80 1904656670 C Ii:1:037:1 0:1 8 = 00004100 00000000
ffff88015f6add80 1904656710 S Ii:1:037:1 -115:1 8 <
ffff88015f6add80 1904771659 C Ii:1:037:1 0:1 8 = 00000000 00000000
ffff88015f6add80 1904771690 S Ii:1:037:1 -115:1 8 <
ffff88015f6add80 1905545796 C Ii:1:037:1 0:1 8 = 00004200 00000000
ffff88015f6add80 1905545834 S Ii:1:037:1 -115:1 8 <
ffff88015f6add80 1905671781 C Ii:1:037:1 0:1 8 = 00000000 00000000
ffff88015f6add80 1905671813 S Ii:1:037:1 -115:1 8 <
